Requirement ID,Requirement Description,Satisfaction Argument,Satisfied by
R.Lookup,"The Name Server is supplied with a Domain Name and shall return either the Resource Location, or the Address of another Name Server.",,"S.Data, S.Cache, S.Cache.Old, S.Lookup, S.Lookup.Fail, S.Input, S.Robustness"
R.Performance,The Name Server must return data in a timely manner.,,"S.Lookup, S.Cache, S.Cache.Old"
R.Accuracy,The Name Server must not use any stale data.,,S.Cache.Old
R.ReverseLookup,"The Name Server must be capable of being supplied with the Address of a resource and then returning the Domain Name, or the Address of another Domain Server",,"S.Lookup, S.Lookup.Fail"
R.Refresh,The Name Server must be capable of having its contents refreshed.,,"S.ReadZoneFile, S.ZoneFileValidation"
R.RefreshFormat,"Any refresh information supplied to the Name Server, should be in format that is a subset of the djbdns format.",,"S.ZoneFileValidation, S.ZoneFileFormat.1, S.ZoneFileFormat.2, S.ZoneFileFormat.3, S.ZoneFileFormat.4,"
R.RefreshAvailability,The Name Server should remain available whilst the contents of the server are being refreshed from the Server.,,S.ZoneFileLoad
